{"schema_version":"0.3.0","phase":"R1.5","production_review_id":"purananuru-r15-production-307","work_id":"purananuru","record_id":"307","record_number":307,"review_sequence_number":307,"source_snapshot":{"canonical_record_path":"corpus/purananuru/poems/307.md","canonical_record_git_blob_sha":"d3bd70413f94b7acd36d27ba26e17e1878c9201d","canonical_record_sha256":"3702bb803c62f64b7020fce2dd8217213ea4fd8323b163f1be3c4d7d5903fd7f","canonical_body_sha256":"729e1e8f9095128f56af01c8e41b72f3b6f38134603bea45bdaacafdf6aad79f","source_note_sha256":"a3c1b6209503efaf1bfc06730659c6cb8e555715eeb47f8149180016aac1ddc1","r0_assertion_record_path":"research/evidence/purananuru/records/307.ndjson","r0_assertion_record_git_blob_sha":"2b3cfbdd5126c10a9c6db88b61b58e5ed72e06cc","textual_status":"complete","canonical_text_available":true,"lacuna_present":false},"source_metadata_reviewed":{"title_as_printed":"யாண்டுளன் கொல்லோ!","poet_as_printed":"பெயர் புலனாகவில்லை","addressee_as_printed":null,"thinai_as_printed":"தும்பை துறை : களிற்றுடனிலை","thurai_as_printed":"களிற்றுடனிலை"},"dimensions_considered":29,"dimension_reviews":[{"ordinal":1,"dimension":"literary_domain","status":"qualifying_evidence_recorded","observation_ids":["obs.prod.r15.392bc06d0e6f8f9613bb109f"],"review_note":"Qualifying source evidence recorded."},{"ordinal":2,"dimension":"tinai_turai","status":"qualifying_evidence_recorded","observation_ids":["obs.prod.r15.02242fade5b84bbbffe081c6","obs.prod.r15.2143f3c25217eea29df108e1"],"review_note":"Qualifying source evidence recorded."},{"ordinal":3,"dimension":"landscape_environment","status":"qualifying_evidence_recorded","observation_ids":["obs.prod.r15.28df7e9ebb19f762c8287c69"],"review_note":"Qualifying source evidence recorded."},{"ordinal":4,"dimension":"season_weather_time","status":"qualifying_evidence_recorded","observation_ids":["obs.prod.r15.453e020dbd012b10d7f236a7"],"review_note":"Qualifying source evidence recorded."},{"ordinal":5,"dimension":"flora","status":"qualifying_evidence_recorded","observation_ids":["obs.prod.r15.45f03f7cf1ca932e4fe79451"],"review_note":"Qualifying source evidence recorded."},{"ordinal":6,"dimension":"fauna","status":"qualifying_evidence_recorded","observation_ids":["obs.prod.r15.6ef7006d113f24739285d666"],"review_note":"Qualifying source evidence recorded."},{"ordinal":7,"dimension":"people_social_roles","status":"qualifying_evidence_recorded","observation_ids":["obs.prod.r15.ddf32fb880f99054df8cd578"],"review_note":"Qualifying source evidence recorded."},{"ordinal":8,"dimension":"relationships","status":"qualifying_evidence_recorded","observation_ids":["obs.prod.r15.84364519ab1b93528e9ff747"],"review_note":"Qualifying source evidence recorded."},{"ordinal":9,"dimension":"emotion_lived_experience","status":"qualifying_evidence_recorded","observation_ids":["obs.prod.r15.7cfa4b08d971907f32b7f144"],"review_note":"Qualifying source evidence recorded."},{"ordinal":10,"dimension":"occupations_production","status":"no_qualifying_evidence_identified","observation_ids":[],"review_note":"No qualifying evidence identified."},{"ordinal":11,"dimension":"food_subsistence","status":"qualifying_evidence_recorded","observation_ids":["obs.prod.r15.67e57094a1521b97376dda93"],"review_note":"Qualifying source evidence recorded."},{"ordinal":12,"dimension":"clothing_ornaments_adornment","status":"no_qualifying_evidence_identified","observation_ids":[],"review_note":"No qualifying evidence identified."},{"ordinal":13,"dimension":"material_culture_everyday_objects","status":"qualifying_evidence_recorded","observation_ids":["obs.prod.r15.a508d52ae2e28595d8817ddf"],"review_note":"Qualifying source evidence recorded."},{"ordinal":14,"dimension":"weapons_warfare","status":"qualifying_evidence_recorded","observation_ids":["obs.prod.r15.1d1126153c8b427fa55030e5"],"review_note":"Qualifying source evidence recorded."},{"ordinal":15,"dimension":"mobility_transport","status":"qualifying_evidence_recorded","observation_ids":["obs.prod.r15.28a8b9242590499f4252582b"],"review_note":"Qualifying source evidence recorded."},{"ordinal":16,"dimension":"settlements_built_environment","status":"no_qualifying_evidence_identified","observation_ids":[],"review_note":"No qualifying evidence identified."},{"ordinal":17,"dimension":"economy","status":"no_qualifying_evidence_identified","observation_ids":[],"review_note":"No qualifying evidence identified."},{"ordinal":18,"dimension":"trade_exchange","status":"no_qualifying_evidence_identified","observation_ids":[],"review_note":"No qualifying evidence identified."},{"ordinal":19,"dimension":"polity_political_life","status":"qualifying_evidence_recorded","observation_ids":["obs.prod.r15.892d85af92541a22cd12bbea"],"review_note":"Qualifying source evidence recorded."},{"ordinal":20,"dimension":"communities_social_groups","status":"qualifying_evidence_recorded","observation_ids":["obs.prod.r15.ff109ff8f39751cbaee211ab"],"review_note":"Qualifying source evidence recorded."},{"ordinal":21,"dimension":"family_gender_kinship","status":"qualifying_evidence_recorded","observation_ids":["obs.prod.r15.b779359e8f8a08a7b60d5746"],"review_note":"Qualifying source evidence recorded."},{"ordinal":22,"dimension":"religion_ritual","status":"no_qualifying_evidence_identified","observation_ids":[],"review_note":"No qualifying evidence identified."},{"ordinal":23,"dimension":"death_mourning_memory","status":"qualifying_evidence_recorded","observation_ids":["obs.prod.r15.2ed0591e9e92556710df1793"],"review_note":"Qualifying source evidence recorded."},{"ordinal":24,"dimension":"arts_music_performance","status":"qualifying_evidence_recorded","observation_ids":["obs.prod.r15.c097f8bf417ec35393b6f81d"],"review_note":"Qualifying source evidence recorded."},{"ordinal":25,"dimension":"knowledge_technology","status":"no_qualifying_evidence_identified","observation_ids":[],"review_note":"No qualifying evidence identified."},{"ordinal":26,"dimension":"values_ethical_concepts","status":"qualifying_evidence_recorded","observation_ids":["obs.prod.r15.338e061822d5efe04299f77c"],"review_note":"Qualifying source evidence recorded."},{"ordinal":27,"dimension":"body_health","status":"qualifying_evidence_recorded","observation_ids":["obs.prod.r15.e9ff31be4c0ebdd470f304d2"],"review_note":"Qualifying source evidence recorded."},{"ordinal":28,"dimension":"named_entities","status":"no_qualifying_evidence_identified","observation_ids":[],"review_note":"`பெயர் புலனாகவில்லை` explicitly states that the poet's name is not ascertainable; this non-name must remain reviewed-empty."},{"ordinal":29,"dimension":"textual_intertextual_relationships","status":"qualifying_evidence_recorded","observation_ids":["obs.prod.r15.fefbc685a69270a619640000"],"review_note":"Qualifying source evidence recorded."}],"observations":[{"observation_id":"obs.prod.r15.392bc06d0e6f8f9613bb109f","dimension":"literary_domain","concept_id":"literary.domain.puram","evidence_class":"SOURCE_EXPLICIT","classification_basis":"work_level_classification","evidence_refs":[{"source_field":"work","source_location":"yaml:work","evidence_span":null,"source_text":"புறநானூறு"}],"supporting_assertion_ids":[],"assertion_provenance_status":"direct_r15_source_review_no_prior_assertion","confidence":"high","review_status":"reviewed","reviewer_type":"assistant_assisted","historical_identity_status":"not_applicable","note":"Work-level Puram classification; not a poem-body claim."},{"observation_id":"obs.prod.r15.02242fade5b84bbbffe081c6","dimension":"tinai_turai","concept_id":null,"evidence_class":"SOURCE_EXPLICIT","classification_basis":"source_metadata_explicit","evidence_refs":[{"source_field":"thinai_as_printed","source_location":"yaml:thinai_as_printed","evidence_span":null,"source_text":"தும்பை துறை : களிற்றுடனிலை"}],"supporting_assertion_ids":["asrt.1c669d96cb309d4b495afb5f"],"assertion_provenance_status":"existing_r0_assertion_linked","confidence":"high","review_status":"reviewed","reviewer_type":"assistant_assisted","historical_identity_status":"not_applicable","note":"Source-explicit evidence retained without external expansion."},{"observation_id":"obs.prod.r15.2143f3c25217eea29df108e1","dimension":"tinai_turai","concept_id":null,"evidence_class":"SOURCE_EXPLICIT","classification_basis":"source_metadata_explicit","evidence_refs":[{"source_field":"thurai","source_location":"yaml:thurai","evidence_span":null,"source_text":"களிற்றுடனிலை"}],"supporting_assertion_ids":["asrt.5c2639e2db87db9306ce1151"],"assertion_provenance_status":"existing_r0_assertion_linked","confidence":"high","review_status":"reviewed","reviewer_type":"assistant_assisted","historical_identity_status":"not_applicable","note":"Source-explicit evidence retained without external expansion."},{"observation_id":"obs.prod.r15.28df7e9ebb19f762c8287c69","dimension":"landscape_environment","concept_id":null,"evidence_class":"SOURCE_EXPLICIT","classification_basis":"direct_record_review","evidence_refs":[{"source_field":"canonical_body","source_location":"markdown:canonical-body","evidence_span":{"start_line":2,"start_character":0,"end_line":2,"end_character":33},"source_text":"குன்றத்து அன்ன களிற்றொடு பட்டோன்;"},{"source_field":"canonical_body","source_location":"markdown:canonical-body","evidence_span":{"start_line":4,"start_character":0,"end_line":9,"end_character":31},"source_text":"வேனல் வரி அணில் வாலத்து அன்ன;\nகான ஊகின் கழன்றுகு முதுவீ\nஅரியல் வான்குழல் சுரியல் தங்க,\nநீரும் புல்லும் ஈயாது உமணர்\nயாரும்இல் ஒருசிறை முடத்தொடு துறந்த\nவாழா வான்பகடு ஏய்ப்பத், தெறுவர்"}],"supporting_assertion_ids":[],"assertion_provenance_status":"direct_r15_source_review_no_prior_assertion","confidence":"high","review_status":"reviewed","reviewer_type":"assistant_assisted","historical_identity_status":"not_applicable","note":"Mountain, summer forest and abandoned dry-route setting are explicit environment evidence."},{"observation_id":"obs.prod.r15.453e020dbd012b10d7f236a7","dimension":"season_weather_time","concept_id":null,"evidence